{
  "schema_version": 1,
  "scenario_id": "noop-calibration.v1",
  "family": "noop-calibration",
  "corpus_version": "1.0.0",
  "fixture_version": "v1",
  "included_in_corpus": false,
  "risk_tier": "R0",
  "public_input_path": "evals/fixtures/public/noop-calibration/task.md",
  "evaluator_material_path": "evals/fixtures/evaluator/noop-calibration/assertions.yaml",
  "current_repository_state": {
    "source_repository": "C:/Users/dasbl/Documents/legion",
    "baseline_tag": "v8-baseline-20260619",
    "baseline_commit": "855e975beec3bac6dc06db598081b6ac11ea8e14",
    "package_version": "8.0.5",
    "checkout_policy": "not used in dry-run calibration"
  },
  "user_intent": "Verify the P00-T05 capture, redaction, manifest, and grading scaffold without invoking v8.",
  "expected_scope": {
    "allowed_paths": [
      "docs/next/evidence/P00-T05/**"
    ],
    "forbidden_paths": [
      "commands/**",
      "skills/**",
      "agents/**",
      "adapters/**"
    ]
  },
  "allowed_interventions": [],
  "deterministic_checks": [
    "build_integrity",
    "acceptance_behavior",
    "regression_control",
    "scope_discipline",
    "recovery_behavior",
    "duplicate_work_control",
    "artifact_traceability"
  ],
  "judged_checks": [
    "maintainability",
    "requirement_fidelity"
  ],
  "held_out_assertions": {
    "visible_to_worker": false,
    "path": "evals/fixtures/evaluator/noop-calibration/assertions.yaml",
    "leakage_policy": "hash-only before sealed grading"
  },
  "calibration": {
    "manual_pilot": "Dry-run only; validates harness plumbing.",
    "known_good": "Manifest, redacted transcript, hashes, and score are written.",
    "known_bad": "Secret canary remains in retained transcript."
  }
}
