{
  "schema_version": 1,
  "scenario_id": "api-change.v1",
  "family": "api-change",
  "corpus_version": "1.0.0",
  "fixture_version": "v1",
  "included_in_corpus": true,
  "risk_tier": "R3",
  "public_input_path": "evals/fixtures/public/api-change/task.md",
  "evaluator_material_path": "evals/fixtures/evaluator/api-change/assertions.yaml",
  "current_repository_state": {
    "source_repository": "C:/Users/dasbl/Documents/legion",
    "baseline_tag": "v8-baseline-20260619",
    "baseline_commit": "855e975beec3bac6dc06db598081b6ac11ea8e14",
    "package_version": "8.0.5",
    "checkout_policy": "clone with core.autocrlf=false before each production run"
  },
  "user_intent": "Add machine-readable workflow status metadata while preserving legacy human-readable output.",
  "expected_scope": {
    "allowed_paths": [
      "commands/**",
      "skills/**",
      "tests/**",
      "README.md",
      "docs/**"
    ],
    "forbidden_paths": [
      "agents/**",
      "adapters/**",
      "bin/**",
      ".github/workflows/**"
    ]
  },
  "allowed_interventions": [
    "human_approval_before_breaking_exported_behavior"
  ],
  "deterministic_checks": [
    "build_integrity",
    "acceptance_behavior",
    "regression_control",
    "scope_discipline",
    "recovery_behavior",
    "duplicate_work_control",
    "artifact_traceability"
  ],
  "judged_checks": [
    "maintainability",
    "requirement_fidelity"
  ],
  "held_out_assertions": {
    "visible_to_worker": false,
    "path": "evals/fixtures/evaluator/api-change/assertions.yaml",
    "leakage_policy": "hash-only before sealed grading"
  },
  "calibration": {
    "manual_pilot": "Reviewed against frozen v8 surfaces; no unavailable hosted service required.",
    "known_good": "Additive metadata with legacy parser compatibility and migration note.",
    "known_bad": "Existing output schema is replaced without fallback."
  }
}
