{
  "schema_version": 1,
  "scenario_id": "bug-fix.v1",
  "family": "bug-fix",
  "corpus_version": "1.0.0",
  "fixture_version": "v1",
  "included_in_corpus": true,
  "risk_tier": "R2",
  "public_input_path": "evals/fixtures/public/bug-fix/task.md",
  "evaluator_material_path": "evals/fixtures/evaluator/bug-fix/assertions.yaml",
  "current_repository_state": {
    "source_repository": "C:/Users/dasbl/Documents/legion",
    "baseline_tag": "v8-baseline-20260619",
    "baseline_commit": "855e975beec3bac6dc06db598081b6ac11ea8e14",
    "package_version": "8.0.5",
    "checkout_policy": "clone with core.autocrlf=false before each production run"
  },
  "user_intent": "Fix stale active-task reconciliation in an interrupted workflow resume path.",
  "expected_scope": {
    "allowed_paths": [
      "skills/**",
      "commands/**",
      "tests/**"
    ],
    "forbidden_paths": [
      "agents/**",
      "adapters/**",
      ".github/workflows/**",
      "package.json"
    ]
  },
  "allowed_interventions": [
    "one_reproduction_clarification"
  ],
  "deterministic_checks": [
    "build_integrity",
    "acceptance_behavior",
    "regression_control",
    "scope_discipline",
    "recovery_behavior",
    "duplicate_work_control",
    "artifact_traceability"
  ],
  "judged_checks": [
    "maintainability",
    "requirement_fidelity"
  ],
  "held_out_assertions": {
    "visible_to_worker": false,
    "path": "evals/fixtures/evaluator/bug-fix/assertions.yaml",
    "leakage_policy": "hash-only before sealed grading"
  },
  "calibration": {
    "manual_pilot": "Reviewed against frozen v8 surfaces; no unavailable hosted service required.",
    "known_good": "Resume reconciliation preserves valid interrupted identity and rejects stale active state.",
    "known_bad": "Restart always discards active state or always trusts stale state."
  }
}
